id,subreddit,label,type,text,title,score,created_utc,time_period,url
d6exdre,r/news,media_public,comment,"None of these numbers actually mean anything. Because the turnover rate for retail is the highest in any sector. I've worked at walmart for every 10 years now, and I only know maybe 3 people from when i started, and they was at store before I even started. lol Oh i was hired on with about 30 people at the time.",,6,1471028606,other,https://reddit.com/r/news/comments/4xds23/nearly_44000_retail_workers_have_been_laid_off_in/
d6emosn,r/news,media_public,comment,"This article stinks. The headline says 44K laid off, but far, far down it says that overall retail has added 200K jobs this year. So, 44K were told to look for work elsewhere, but that's not that big of a deal since 200K openings existed.",,17,1471015431,other,https://reddit.com/r/news/comments/4xds23/nearly_44000_retail_workers_have_been_laid_off_in/
d6evgjg,r/news,media_public,comment,"This number doesn't take into account new hires. It simply totals layoffs and thus only shows half the picture. According to the Bureau of Labor Statistics ( the retail sector has added some 133,000 jobs since January, 2016. So the retail sector has actually grown this year.",,5,1471026298,other,https://reddit.com/r/news/comments/4xds23/nearly_44000_retail_workers_have_been_laid_off_in/
d6f47r3,r/news,media_public,comment,Tell them to come to Minnesota. Every store I go in has a help wanted sign. Even Walmart in my area is offering $11/hr starting.,,2,1471037331,other,https://reddit.com/r/news/comments/4xds23/nearly_44000_retail_workers_have_been_laid_off_in/
33hbji,r/news,media_public,post,Blue Bell: We haven't laid off anyone in 100 years and we won't do it now,Blue Bell: We haven't laid off anyone in 100 years and we won't do it now,485,1429714831,other,https://reddit.com/r/news/comments/33hbji/blue_bell_we_havent_laid_off_anyone_in_100_years/
cqkuz6h,r/news,media_public,comment,"First time they've been forced to recall in over 100 years, too. I trust that kind of track record, personally.",,143,1429715219,other,https://reddit.com/r/news/comments/33hbji/blue_bell_we_havent_laid_off_anyone_in_100_years/
cql4389,r/news,media_public,comment,"Former BlueBell employee (summer job in high school). Have nothing but good things to say about the company, and I will still be buying from them once this blows over.",,52,1429729263,other,https://reddit.com/r/news/comments/33hbji/blue_bell_we_havent_laid_off_anyone_in_100_years/
cql63vr,r/news,media_public,comment,My wife has two family members who work(ed) for Blue Bell and they give the company the highest praises. I knew a lot of Blue Bell guys when I had a beer sales route; I would bitch about mine and they never had anything bad to say about theirs.,,24,1429732267,other,https://reddit.com/r/news/comments/33hbji/blue_bell_we_havent_laid_off_anyone_in_100_years/
cql260j,r/news,media_public,comment,Blue Bell is hands down the best ice cream. When they come back I'll buy some to help support this sentiment.,,59,1429726346,other,https://reddit.com/r/news/comments/33hbji/blue_bell_we_havent_laid_off_anyone_in_100_years/
cql6xpq,r/news,media_public,comment,"I'm not much of an ice cream man (nor a Listeria man for that matter) but once they get their shit together, I will buy a pint just in the name of supporting this type of moral business practice.",,10,1429733513,other,https://reddit.com/r/news/comments/33hbji/blue_bell_we_havent_laid_off_anyone_in_100_years/
32xlom,r/news,media_public,post,Wal-Mart suddenly closed 5 stores and laid off thousands of workers and no one knows why,Wal-Mart suddenly closed 5 stores and laid off thousands of workers and no one knows why,538,1429285040,other,https://reddit.com/r/news/comments/32xlom/walmart_suddenly_closed_5_stores_and_laid_off/
cqfku3y,r/news,media_public,comment,&gt; And no one knows why Bull. The workers were trying to unionize. Wal-Mart isn't interested in any of that.,,377,1429286523,other,https://reddit.com/r/news/comments/32xlom/walmart_suddenly_closed_5_stores_and_laid_off/
cqfmyjk,r/news,media_public,comment,"If you are a Wal-Mart employee go into a bathroom, look into the mirror, and say union three times this will happen to your store.",,78,1429289865,other,https://reddit.com/r/news/comments/32xlom/walmart_suddenly_closed_5_stores_and_laid_off/
cqftnwl,r/news,media_public,comment,"Someone probably did a cost-benefit analysis of closing ""in between"" locations to drive traffic to other stores in order to serve more customers per location.",,7,1429300487,other,https://reddit.com/r/news/comments/32xlom/walmart_suddenly_closed_5_stores_and_laid_off/
cqfqh83,r/news,media_public,comment,"They intentionally came up with an ridiculous justification so that everybody would know why they closed the stores without them actually having to say it. It's like when a dictator gets 99% of the vote in an election. They know that it's patently obvious that it's a sham, but that's the point. They are demonstrating that they can do whatever they want, and they don't care who knows it.",,12,1429295361,other,https://reddit.com/r/news/comments/32xlom/walmart_suddenly_closed_5_stores_and_laid_off/
2o0nsk,r/news,media_public,post,Well-Known Santa Claus Peter Georgi Is Laid Off By Berlin Store,Well-Known Santa Claus Peter Georgi Is Laid Off By Berlin Store,4,1417496816,other,https://reddit.com/r/news/comments/2o0nsk/wellknown_santa_claus_peter_georgi_is_laid_off_by/
2ittkr,r/news,media_public,post,"Houston news station KROI laid off 47 employees Wednesday and will, for the time being, play only Beyoncé songs","Houston news station KROI laid off 47 employees Wednesday and will, for the time being, play only Beyoncé songs",3,1412914956,other,https://reddit.com/r/news/comments/2ittkr/houston_news_station_kroi_laid_off_47_employees/
cl5gfuy,r/news,media_public,comment,Poor people of Houston are made to suffer even more.,,2,1412918695,other,https://reddit.com/r/news/comments/2ittkr/houston_news_station_kroi_laid_off_47_employees/
2hvxyl,r/news,media_public,post,"One-fifth of U.S. workers were laid off in past five years, study says.","One-fifth of U.S. workers were laid off in past five years, study says.",176,1412083453,other,https://reddit.com/r/news/comments/2hvxyl/onefifth_of_us_workers_were_laid_off_in_past_five/
ckwt4q2,r/news,media_public,comment,"95% of the folks working at one of the Apple campuses across the street from my business are here on work visas. They hate hiring locally because they cant work them as hard or pay them as little. Once again, fuck off Apple.",,27,1412107258,other,https://reddit.com/r/news/comments/2hvxyl/onefifth_of_us_workers_were_laid_off_in_past_five/
ckwkz1n,r/news,media_public,comment,"B-but... the Dow Jones Industrial Average is at over 17,000. I thought that meant the economy was fixed...",,31,1412091867,other,https://reddit.com/r/news/comments/2hvxyl/onefifth_of_us_workers_were_laid_off_in_past_five/
ckwn4n7,r/news,media_public,comment,Thanks Goldman Sachs and Merrill Lynch.,,8,1412096052,other,https://reddit.com/r/news/comments/2hvxyl/onefifth_of_us_workers_were_laid_off_in_past_five/
ckwqr0q,r/news,media_public,comment,"*Almost half -- 46% -- of the estimated 30 million layoff victims who found new jobs said they paid less then their old ones, according to the survey of 1,153 U.S adults done over the summer.* How many of those layoff victims settled for jobs through temp agencies? Many manufacturing/production jobs in the US are through temp agencies. These companies never hire you, keeping you at that status for an undetermined amount of time. That means crappy vacation time (if any), bonuses, and no opportunity for advancements. This is what the company I work for does who happens to be worldwide and very well-known. I've read other major companies have resorted to the same tactic.",,5,1412102880,other,https://reddit.com/r/news/comments/2hvxyl/onefifth_of_us_workers_were_laid_off_in_past_five/
ckwp1no,r/news,media_public,comment,"Well lets see, we all knew that the unemployment rate was like 14% (don't quote me on that) and we also know that due to the housing bubble, unemployment was artificially low. Now, I may be wrong, so please don't be an ass hole if my calculations are off, but if according to the article about 20% of US workers were laid off, unemployment was 14% and artificially low before the start of the recession, how does this surprise anyone? It seems pretty accurate to me, and pretty much what I would expect.",,2,1412099650,other,https://reddit.com/r/news/comments/2hvxyl/onefifth_of_us_workers_were_laid_off_in_past_five/
1w4bd4,r/news,media_public,post,CNN laid off more than 40 senior journalists at the end of 2013,CNN laid off more than 40 senior journalists at the end of 2013,103,1390664513,other,https://reddit.com/r/news/comments/1w4bd4/cnn_laid_off_more_than_40_senior_journalists_at/
ceyktwd,r/news,media_public,comment,I never knew CNN *had* 40 senior journalists. Were they keeping them in a box in case CNN ever became interested in journalism?,,53,1390667215,other,https://reddit.com/r/news/comments/1w4bd4/cnn_laid_off_more_than_40_senior_journalists_at/
ceyk0l8,r/news,media_public,comment,What do they need with qualified journalists?,,21,1390664635,other,https://reddit.com/r/news/comments/1w4bd4/cnn_laid_off_more_than_40_senior_journalists_at/
ceypte3,r/news,media_public,comment,"I love this sentence. It's so honest. ""Last November The Wrap reported CNN had laid off producers as “part of a plan to restructure the cable news network’s approach to entertainment coverage.”",,17,1390680437,other,https://reddit.com/r/news/comments/1w4bd4/cnn_laid_off_more_than_40_senior_journalists_at/
ceyjzq4,r/news,media_public,comment,This explains why their Justin Bieber coverage was so lacking this week.,,26,1390664554,other,https://reddit.com/r/news/comments/1w4bd4/cnn_laid_off_more_than_40_senior_journalists_at/
ceyz94e,r/news,media_public,comment,"They probably caught them trying to ""fact check"" some of those press releases before they got to the teleprompter.",,6,1390704672,other,https://reddit.com/r/news/comments/1w4bd4/cnn_laid_off_more_than_40_senior_journalists_at/
1j39nl,r/news,media_public,post,"LSU Hospital employees to be laid off, asked to reapply","LSU Hospital employees to be laid off, asked to reapply",55,1374836645,other,https://reddit.com/r/news/comments/1j39nl/lsu_hospital_employees_to_be_laid_off_asked_to/
cbaqqg7,r/news,media_public,comment,"This is a corporate practice... I've seen it directly used at an American Express corporate office. They laid off the entire staff of around 250 workers, and re-hired most of them with different job titles at a lesser pay and usually taking on more responsibilities. Very sad for the workers.",,12,1374851145,other,https://reddit.com/r/news/comments/1j39nl/lsu_hospital_employees_to_be_laid_off_asked_to/
cbaqkbi,r/news,media_public,comment,"When rehired, do they go back to the original salary?",,5,1374850662,other,https://reddit.com/r/news/comments/1j39nl/lsu_hospital_employees_to_be_laid_off_asked_to/
cbazqg3,r/news,media_public,comment,"This is standard practice and quite frankly, I don't see anything wrong with it. What LSU Hospital is essentially doing is a complete staff review to make sure those staying on board are actually qualified to work there. In public workplaces people don't usually get terminated for not performing - they just don't get promoted. Termination is really only reserved for gross incompetence or violating safety policies. Also with minimum pay increase guidelines for all employees, there are usually a decent amount of people who are earning far more than what their work is worth just because they have been there for awhile. What this does is it allows the organization a way to see who is qualified for what position and to make sure they're getting compensated for their actual skills. In the medical industry there is also another very important dimension, it makes sure all your older staff have the proper knowledge of new medical procedures.",,2,1374874250,other,https://reddit.com/r/news/comments/1j39nl/lsu_hospital_employees_to_be_laid_off_asked_to/
cbaoroe,r/news,media_public,comment,"Interesting. I had a management teacher who argued for this practice. According to her, state run facilities like this usually have tons of people who are there simply because they have been there for a long time. They've failed to continue their training and keep up with the newest practices, but unfortunately don't have the personality, brains, or work ethic for management. They become, essentially, useless at the job they've been at for a long time. I believe when we posed the ethical question of canning someone who has been there for years and may not be able to afford training, and she said she thought retraining programs for current staff should be a priority for any medical institution that desires to stay competitive in the current atmosphere. It was an interesting counter-point.",,3,1374844789,other,https://reddit.com/r/news/comments/1j39nl/lsu_hospital_employees_to_be_laid_off_asked_to/
cbb8y27,r/news,media_public,comment,[LSU medical center employee speaks out about takeover](,,1,1374904879,other,https://reddit.com/r/news/comments/1j39nl/lsu_hospital_employees_to_be_laid_off_asked_to/
1fcen9,r/news,media_public,post,Chicago Sun Times just laid off their entire Photography staff. Plans to use freelancers and focus on Video reporting. A sign of things to come?,Chicago Sun Times just laid off their entire Photography staff. Plans to use freelancers and focus on Video reporting. A sign of things to come?,2,1369931259,other,https://reddit.com/r/news/comments/1fcen9/chicago_sun_times_just_laid_off_their_entire/
1dy178,r/news,media_public,post,"Michigan School District Goes Broke, All Staff Laid Off","Michigan School District Goes Broke, All Staff Laid Off",75,1368036261,other,https://reddit.com/r/news/comments/1dy178/michigan_school_district_goes_broke_all_staff/
c9v3swz,r/news,media_public,comment,"This article is completely incoherent. I have no idea what's going on or how many schools are affected. There's only one school mentioned, called the ""Wolverine Treatment Center"" (huh?) and the incoherent explanation for the whole situation is attributed to this school: ""Here's a look at how the situation got to this point. The state was funding the Wolverine Treatment Center even though the district didn't provide any teachers. In response, the state has stopped sending aid for April, May, and June. As a result, the district laid off its teachers immediately and cancelled class."" WTF?",,15,1368053535,other,https://reddit.com/r/news/comments/1dy178/michigan_school_district_goes_broke_all_staff/
c9uyb0v,r/news,media_public,comment,i like how the district is taking zero accountability in how it even got itself in this position or even trying to propose a solution. honestly it seems like they aren't even trying if their knee-jerk reaction is to fire everyone immediately.,,17,1368039461,other,https://reddit.com/r/news/comments/1dy178/michigan_school_district_goes_broke_all_staff/
c9v76y0,r/news,media_public,comment,"I was surprised it was not a district in Detroit. It appears that the school district had a program for troubled youth, but the district kept running a deficit. The program stopped receiving funds from the school district, so it cut ties with the school district. The whole time the district received aid from the state, in order to provide schooling for these alternative students that the school district was not actually funding. The state found out that the school was not supporting the program and kept receiving the aid. The state cut off their funding for the next 3 months. TL;DR: The school district committed fraud and the state cut them off for 3 months to recuperate the 401k dollars that the school district was given to fund the program . This is a better article provided by /u/igorsway",,3,1368062779,other,https://reddit.com/r/news/comments/1dy178/michigan_school_district_goes_broke_all_staff/
c9v0p8k,r/news,media_public,comment,"Michigan has always seemed like it has been hurting financially, yet somehow we are able to pay for an unnecessary full time legislature. Michigan is 1 of 4 states with a full time legislature, for what? What in Michigan is so important we need a full time government...",,3,1368045505,other,https://reddit.com/r/news/comments/1dy178/michigan_school_district_goes_broke_all_staff/
c9v0exs,r/news,media_public,comment,lol. no more free daycare for your kids now.,,-3,1368044787,other,https://reddit.com/r/news/comments/1dy178/michigan_school_district_goes_broke_all_staff/
168fuq,r/news,media_public,post,"11,000 US teachers laid off in December","11,000 US teachers laid off in December",84,1357710332,other,https://reddit.com/r/news/comments/168fuq/11000_us_teachers_laid_off_in_december/
c7togd8,r/news,media_public,comment,"This is what 'budget cuts' really means - job loss. Ergo, tax revenue lost, unemployment bill higher. Then there is that pesky human suffering. If the government does not exist for the benefit of the governed then what is the point of it?",,11,1357710787,other,https://reddit.com/r/news/comments/168fuq/11000_us_teachers_laid_off_in_december/
c7ttf8j,r/news,media_public,comment,"Fairly frequently I read some news which says the US is way behind in science and math education. I wonder if there is any correlation with reducing the number of teachers. Well, you know, we gotta keep spending obscene amounts on ""defense.""",,5,1357742956,other,https://reddit.com/r/news/comments/168fuq/11000_us_teachers_laid_off_in_december/
c7tsxxq,r/news,media_public,comment,The possibility of Charter and private schools displacing public school needs seems a bit of a chicken and the egg issue. I personally would want to send my kids to private or better charter school if possible *because* of the dismal public school environment in many cases. But frequently those dismal environments are being caused by lack of proper staff.,,2,1357740784,other,https://reddit.com/r/news/comments/168fuq/11000_us_teachers_laid_off_in_december/
c7tuij9,r/news,media_public,comment,"A lot would argue that it is not a matter of total amount spending. In the US per pupil spending has been increasing for decades. I took a class in college called economics of education and read a lot about this. In my opinion, it comes down to a few things. 1. What money goes to the schools isn't being spent effectively (too much administration). The same could be said with higher education. 2. Parents are ineffective at parenting/see it as the school's job to parent their children. 3. There is no effective way to measure teacher performance and the teacher's unions are inflexible. Many of us have had teachers who didn't belong. As it stands now, there is no magic bullet in terms of getting rid of bad teachers. However, I think that paying teachers more would attract a better crop of new ones.",,3,1357747083,other,https://reddit.com/r/news/comments/168fuq/11000_us_teachers_laid_off_in_december/
c7ttx9j,r/news,media_public,comment,government schools have failed us the whole system is obsolete,,1,1357744960,other,https://reddit.com/r/news/comments/168fuq/11000_us_teachers_laid_off_in_december/
z5g4j,r/news,media_public,post,"EDMC / Goldman Sachs essentially just laid off 800 of my teachers Yes I understand that the Art Institute is a chain of for profit schools, and I should have known better, however the reason I was drawn to this school was for the exceptional staff and gear I would have access to as opposed to state schools. I went to a state school for two years and enjoyed it, but then I switched to AI and my teachers and classes got overwhelmingly better. I'm an Audio Engineer major and I get to have class inside of a multi million dollar studio as well as reserve time in it for free whenever I want. One of our teachers is Bob Seger's personal engineer. My academic director wrote the goddamn Oscar Meyer Wiener song, and now he's getting laid off because he makes to much money, and his position is instantly re-opened for twice the responsibility at a fraction of the pay with no benefits. EDMC just laid off 800 staffers through out the Art Institute 11 of which directly affected my campus, effectively destroying essential teacher's in half of the programs here on campus. For a school that I pay almost 90K to attend this is just disgusting. All in the name of the bottom line.",EDMC / Goldman Sachs essentially just laid off 800 of my teachers,3,1346442029,other,https://reddit.com/r/news/comments/z5g4j/edmc_goldman_sachs_essentially_just_laid_off_800/
c62z5fw,r/news,media_public,comment,"I somewhat agree. I am attending the Art Institute of California - Inland Empire, and was told a lot of office staff are being laid off, and the rest will be taking on jobs of multiple people. Fortunately, someone at my school fought for no teachers to be laid off, but that also means many, if not all of our academic advisors are gone. Also, a number of academic directors will be gone as well. The directors that do stay (or replace current ones) will oversee multiple majors rather than just one, as well as the majors getting somewhat more adjoined at the hip. Game Art &amp; Design and Media Arts &amp; Animation will be handled by one director, and I think Audio Production will be as well. Graphic Design and Web Design overseen by one as well. While that doesn't seem like a huge stretch, it's still awkward. And apparently the foundations classes director at my school, who is interim overseer for media arts and game art right now won't even be on staff after this quarter ends. Seems like a pretty big shafting to me. The school claims low enrollment rates, but I see more and more students every quarter. Our campus has expanded by two buildings in the last two quarters - this does not seem like low enrollment at my campus. I could understand downsizing campuses that are slowing down, but it seems like it's a blanket downsizing even over campuses that shouldn't be getting it. As well as the layoffs from earlier this year. I don't understand how it is justifiable to let staff go from my school when classes are ever expanding. Blanket downsizing was a bad decision. I understand it would seem unfair to just screw students at one school for low enrollment rates, but I swear if my quality of education is reduced due to this I will not be pleased and I'll find a way to make the school responsible for my losses.",,1,1346709432,other,https://reddit.com/r/news/comments/z5g4j/edmc_goldman_sachs_essentially_just_laid_off_800/
ybgjv,r/news,media_public,post,"Wife of deceased firefighter and two seriously injured children from a drunken driving crash denied disability from insurance company to spend more time at hospital with her children, twice, despite doctor's letters urging otherwise. Upon returning to her job, she discovered she had been laid off.","Wife of deceased firefighter and two seriously injured children from a drunken driving crash denied disability from insurance company to spend more time at hospital with her children, twice, despite doctor's letters urging otherwise.  Upon returning to her job, she discovered she had been laid off.",231,1345122077,other,https://reddit.com/r/news/comments/ybgjv/wife_of_deceased_firefighter_and_two_seriously/
c5u7r2q,r/news,media_public,comment,"This sucks, but the amount of money we're talking about here is probably trivial. Short term disability typically covers a set percentage of *her* income (usually 50%-70%) for the two months her kid was in the hospital. If she makes $50,000/yr then we're talking about around $4,167-$5,833. Not chump change, but certainly not a fortune. She'll be eligible for any life insurance and AD&amp;D coverage her husband had plus pension benefits (which almost always kick in immediately for a spouse upon the enrollee's death). Plus she is probably getting a settlement from the drunk driver's insurance. It's sad that in times of tragedy people have to go to court to fight for a service they've already paid for, but, financially, this lady is probably not struggling to pay her bills. The fact that she was fired seems like an FMLA issue, and has nothing to do with Liberty.",,8,1345146751,other,https://reddit.com/r/news/comments/ybgjv/wife_of_deceased_firefighter_and_two_seriously/
c5u4bct,r/news,media_public,comment,"This is a sad story. Not to be a jerk, but my understanding is that ""disability insurance"" pays when the covered person is injured or ill or unable to work because of a disability. In this case, the covered persons' family member (son) was injured and in the hospital -- the woman herself was not injured or ill. It sounds like the woman's doctor tried to establish that she herself was disabled because she was depressed about what her son was going through. It sounds like the woman needed some sort of ""family care"" clause in her disability insurance policy, that was not there. It also sounds like the woman should have invoked the Family Medical Leave Act (if her position at her job was covered by that act) -- that can protect the job of a person who has to be absent to care for an ill family member (but it does not mandate that the employer pay a salary to the absent employee).",,12,1345135120,other,https://reddit.com/r/news/comments/ybgjv/wife_of_deceased_firefighter_and_two_seriously/
