id,subreddit,label,type,text,title,score,created_utc,time_period,url
1rt7s72,r/news,media_public,post,Meta planning sweeping layoffs as AI costs mount,Meta planning sweeping layoffs as AI costs mount,635,1773456120,2026,https://reddit.com/r/news/comments/1rt7s72/meta_planning_sweeping_layoffs_as_ai_costs_mount/
oacvoyy,r/news,media_public,comment,Doesnt Meta do “sweeping layoffs” like every 6 months? At what point is it just bad management?,,159,1773466753,2026,https://reddit.com/r/news/comments/1rt7s72/meta_planning_sweeping_layoffs_as_ai_costs_mount/
oac9bm5,r/news,media_public,comment,Someday it will be called the “AI bust”. Just a matter of when not if.,,321,1773456538,2026,https://reddit.com/r/news/comments/1rt7s72/meta_planning_sweeping_layoffs_as_ai_costs_mount/
oacf11j,r/news,media_public,comment,"We floated the majority of our economic growth on something that is inaccurate, unwanted, expensive, taxing on infrastructure, and will put people out of work. All to generate porn.",,231,1773458834,2026,https://reddit.com/r/news/comments/1rt7s72/meta_planning_sweeping_layoffs_as_ai_costs_mount/
oachxgu,r/news,media_public,comment,I can't wait for Meta to cannibalize itself by going all in on AI. It will eventually just be hallucinating to itself when finally all the advertisers and those buying our data realized that there is no more human data being input.,,81,1773460054,2026,https://reddit.com/r/news/comments/1rt7s72/meta_planning_sweeping_layoffs_as_ai_costs_mount/
oaccx2m,r/news,media_public,comment,We need some sanity at the actual decision making level of leadership. Too many selfish criminals believing their own hype.,,39,1773457965,2026,https://reddit.com/r/news/comments/1rt7s72/meta_planning_sweeping_layoffs_as_ai_costs_mount/
1qyt1h3,r/news,media_public,post,"Washington Post publisher Will Lewis says he's stepping down, days after big layoffs at the paper","Washington Post publisher Will Lewis says he's stepping down, days after big layoffs at the paper",2625,1770507323,2026,https://reddit.com/r/news/comments/1qyt1h3/washington_post_publisher_will_lewis_says_hes/
o45y5pb,r/news,media_public,comment,"&gt; Washington Post publisher Will Lewis said Saturday that he’s stepping down, three days after the troubled newspaper said that it was laying off one-third of its staff. &gt; &gt; Lewis sent an email to the Post’s staff, saying that “difficult decisions have been taken in order to ensure the sustainable future of The Post.” Lewis and the newspaper’s billionaire owner Jeff Bezos, did not participate in a meeting with staff announcing the layoffs this week. ... more updates to follow.",,365,1770507362,2026,https://reddit.com/r/news/comments/1qyt1h3/washington_post_publisher_will_lewis_says_hes/
o45ymo0,r/news,media_public,comment,Democracy is dying in darkness.,,830,1770507526,2026,https://reddit.com/r/news/comments/1qyt1h3/washington_post_publisher_will_lewis_says_hes/
o45ytx5,r/news,media_public,comment,Bezos took a bonesaw to the post.,,115,1770507599,2026,https://reddit.com/r/news/comments/1qyt1h3/washington_post_publisher_will_lewis_says_hes/
o45ynud,r/news,media_public,comment,Jeff Bezos decided he doesn't need or want facts anymore.,,299,1770507538,2026,https://reddit.com/r/news/comments/1qyt1h3/washington_post_publisher_will_lewis_says_hes/
o46ca82,r/news,media_public,comment,John Locke was a proponent of the idea that if the powers that be didn’t obey the social contract that it was essential for a functioning society to revolt against them. We are seeing the powers that be continuing to disrupt and disregard any lives other than themselves and their superiors. We cannot be expected to continue being a “western world” and submit to this dynamic any longer.,,175,1770512436,2026,https://reddit.com/r/news/comments/1qyt1h3/washington_post_publisher_will_lewis_says_hes/
1qvpqse,r/news,media_public,post,Bezos-owned storied newspaper Washington Post rolling out mass layoffs,Bezos-owned storied newspaper Washington Post rolling out mass layoffs,2855,1770214696,2026,https://reddit.com/r/news/comments/1qvpqse/bezosowned_storied_newspaper_washington_post/
o3j8sid,r/news,media_public,comment,I guess articles written by AI does not need so many real people.,,873,1770214988,2026,https://reddit.com/r/news/comments/1qvpqse/bezosowned_storied_newspaper_washington_post/
o3j8yis,r/news,media_public,comment,You don't need journalists to print the regimes talking points. Thanks Bezos.,,506,1770215041,2026,https://reddit.com/r/news/comments/1qvpqse/bezosowned_storied_newspaper_washington_post/
o3j913u,r/news,media_public,comment,"If I was a billionaire, i would own a newspaper in trust as a vanity project to make it the best damn newspaper in the world profitability be damned. Maybe that is why I am not a billionaire.",,343,1770215064,2026,https://reddit.com/r/news/comments/1qvpqse/bezosowned_storied_newspaper_washington_post/
o3ja583,r/news,media_public,comment,Remember they just paid a bribe to trump through the Melanie doc for 70 million. That could pay quite a few journalists. Bezos can lick my fucking nuts.,,190,1770215408,2026,https://reddit.com/r/news/comments/1qvpqse/bezosowned_storied_newspaper_washington_post/
o3jcj07,r/news,media_public,comment,Spends $30M on a propaganda movie/bribe. Lays off employees. Makes sense for a shit stain like Bezos.,,43,1770216147,2026,https://reddit.com/r/news/comments/1qvpqse/bezosowned_storied_newspaper_washington_post/
1qoy5wi,r/news,media_public,post,Amazon bungles Wednesday layoff plan with misfired internal email,Amazon bungles Wednesday layoff plan with misfired internal email,4161,1769565921,2026,https://reddit.com/r/news/comments/1qoy5wi/amazon_bungles_wednesday_layoff_plan_with/
o25yxx0,r/news,media_public,comment,"Hahaha of course it was from this VP. This VP was the same one who sent out this really awkward email with RTO written with AI. And, many other awkward emails for people who had the joy to be under their org.",,1061,1769579042,2026,https://reddit.com/r/news/comments/1qoy5wi/amazon_bungles_wednesday_layoff_plan_with/
o24ytsm,r/news,media_public,comment,Please be AI; please be AI; please be AI; please be AI; please be AI; please be AI; please be AI,,1927,1769566194,2026,https://reddit.com/r/news/comments/1qoy5wi/amazon_bungles_wednesday_layoff_plan_with/
o26irxl,r/news,media_public,comment,"My personal email domain is similar to a small business's of a few hundred staff, and I would occasionally receive emails intended for them. Then they were acquired, and I was sent a spreadsheet of all staff, highlighting the ones (over half) to be made redundant. I felt sorry for them but there was nothing I could do of course.",,293,1769588859,2026,https://reddit.com/r/news/comments/1qoy5wi/amazon_bungles_wednesday_layoff_plan_with/
o25uj1m,r/news,media_public,comment,Should be revised to “…decisions are made thoughtlessly….” That’s one way to test the new AI capabilities.,,432,1769577158,2026,https://reddit.com/r/news/comments/1qoy5wi/amazon_bungles_wednesday_layoff_plan_with/
o25d5wz,r/news,media_public,comment,they called it “Project Dawn” wtf,,563,1769570781,2026,https://reddit.com/r/news/comments/1qoy5wi/amazon_bungles_wednesday_layoff_plan_with/
1qnt0j8,r/news,media_public,post,Amazon to cut thousands of jobs in sweeping corporate layoffs,Amazon to cut thousands of jobs in sweeping corporate layoffs,3892,1769461712,2026,https://reddit.com/r/news/comments/1qnt0j8/amazon_to_cut_thousands_of_jobs_in_sweeping/
o1w8n2w,r/news,media_public,comment,"&gt;*... linked the October cuts to the rise of artificial intelligence software, saying in an internal letter to staff that ""this generation of AI is the most transformative technology we’ve seen since the internet...""* ""Transformative"" alright. 30,000 workers will have their lives transformed---or malformed.",,1782,1769462229,2026,https://reddit.com/r/news/comments/1qnt0j8/amazon_to_cut_thousands_of_jobs_in_sweeping/
o1w7h69,r/news,media_public,comment,Welcome to the future !,,656,1769461920,2026,https://reddit.com/r/news/comments/1qnt0j8/amazon_to_cut_thousands_of_jobs_in_sweeping/
o1wbp53,r/news,media_public,comment,"But AI is so ""innovative"" people! At getting rid of human labor while pocketing the difference. It will be great for ""their"" economy. Not for the average person as less and less people will be able to afford things, as prices will keep going up to make up for the lack of people being able to participate in this new ""economy"". But think of the value created for the shareholders!",,198,1769463039,2026,https://reddit.com/r/news/comments/1qnt0j8/amazon_to_cut_thousands_of_jobs_in_sweeping/
o1wgojq,r/news,media_public,comment,"In a sane world automation and ai taking jobs would be good because it would mean higher wages and shorter working days for working people. Instead all it means is unemployment, poverty, and bezos getting to buy another super yacht.",,102,1769464365,2026,https://reddit.com/r/news/comments/1qnt0j8/amazon_to_cut_thousands_of_jobs_in_sweeping/
o1whf4r,r/news,media_public,comment,Remember Jeff sitting at inauguration? Winning yet ? Oh so tired of all the winning I keep seeing.,,48,1769464560,2026,https://reddit.com/r/news/comments/1qnt0j8/amazon_to_cut_thousands_of_jobs_in_sweeping/
1oq0qhu,r/news,media_public,post,Layoff announcements surged last month: The worst October in 22 years,Layoff announcements surged last month: The worst October in 22 years,5039,1762440175,2025,https://reddit.com/r/news/comments/1oq0qhu/layoff_announcements_surged_last_month_the_worst/
nnffacy,r/news,media_public,comment,# 10 Richest U.S. Billionaires Have Expanded Wealth by $700 Billion Since Trump’s Return [ # Fortune 500 in 2025: Record profits [,,1231,1762441468,2025,https://reddit.com/r/news/comments/1oq0qhu/layoff_announcements_surged_last_month_the_worst/
nnfcq3y,r/news,media_public,comment,Are we tired of winning yet?,,889,1762440694,2025,https://reddit.com/r/news/comments/1oq0qhu/layoff_announcements_surged_last_month_the_worst/
nnfh3id,r/news,media_public,comment,"Constant flip-flopping on tariffs, breaking trade deals, fomenting divisiveness, a never ending government shutdown, and discouraging all foreign tourists from coming here will do that.",,195,1762442010,2025,https://reddit.com/r/news/comments/1oq0qhu/layoff_announcements_surged_last_month_the_worst/
nnfcatw,r/news,media_public,comment,"and of course, we no longer have official Government data numbers",,240,1762440566,2025,https://reddit.com/r/news/comments/1oq0qhu/layoff_announcements_surged_last_month_the_worst/
nnfexi1,r/news,media_public,comment,Every damn time republicans are in control our economy tanks then dems have to come to the rescue.,,638,1762441358,2025,https://reddit.com/r/news/comments/1oq0qhu/layoff_announcements_surged_last_month_the_worst/
1ojlu9q,r/news,media_public,post,"Paramount Skydance begins layoffs, plans to slash about 2,000 jobs","Paramount Skydance begins layoffs, plans to slash about 2,000 jobs",4167,1761785008,2025,https://reddit.com/r/news/comments/1ojlu9q/paramount_skydance_begins_layoffs_plans_to_slash/
nm40w7q,r/news,media_public,comment,"Cut jobs, buy Warner bros, cut those jobs. Sell off Warner tv channels. Daddy owns tiktok.",,1383,1761785432,2025,https://reddit.com/r/news/comments/1ojlu9q/paramount_skydance_begins_layoffs_plans_to_slash/
nm3ztqn,r/news,media_public,comment,Didn't we just give these companies all huge tax cuts? When does the trickle down start?,,1090,1761785071,2025,https://reddit.com/r/news/comments/1ojlu9q/paramount_skydance_begins_layoffs_plans_to_slash/
nm44he3,r/news,media_public,comment,"Add to the list! GM (1,200) Paramount (10% or 2,000) Amazon (14,000) UPS (48,000) Target (1,800 or 8%) Meta (600) Microsoft (9,000 after cutting 6,000 earlier this year) TCS (6,000) Salesforce (4,000) Accenture (11,000) IBM (1,000) Cognizant (3,500) Intel (529) Spirit Airlines (2,000+)",,438,1761786648,2025,https://reddit.com/r/news/comments/1ojlu9q/paramount_skydance_begins_layoffs_plans_to_slash/
nm48wu3,r/news,media_public,comment,If only there was some way to quantify employment data. Maybe even release reports on it periodically,,90,1761788171,2025,https://reddit.com/r/news/comments/1ojlu9q/paramount_skydance_begins_layoffs_plans_to_slash/
nm41yar,r/news,media_public,comment,Lol they literally just gave a right wing wack job Bari Weiss 150 million for her company and to make her editor and chief of CBS,,249,1761785788,2025,https://reddit.com/r/news/comments/1ojlu9q/paramount_skydance_begins_layoffs_plans_to_slash/
1nq5cjp,r/news,media_public,post,Starbucks announces significant store closures and layoffs,Starbucks announces significant store closures and layoffs,24140,1758803108,2025,https://reddit.com/r/news/comments/1nq5cjp/starbucks_announces_significant_store_closures/
ng4bklp,r/news,media_public,comment,"It’s funny how they mention that they’re specifically planning on renovating locations after the downsizing to make them more comfortable and inviting. They just finished a total renovation of a location near me and they did like the exact opposite of this, the seating is noticeably cheaper and less comfortable with less of it than before, the lighting is terrible, and the layout is less functional with a side exit that used to be right by the pick up counter now completely closed off with the pick up counter moved. All this rambling to say that no, the renovations will probably not be for increased comfort they will be to further streamline and cut more corners to try to save a buck in the long term.",,2583,1758805185,2025,https://reddit.com/r/news/comments/1nq5cjp/starbucks_announces_significant_store_closures/
ng460b6,r/news,media_public,comment,Damn. Didn’t think they would close the Starbucks across the street from the other Starbucks,,7430,1758803213,2025,https://reddit.com/r/news/comments/1nq5cjp/starbucks_announces_significant_store_closures/
ng46bze,r/news,media_public,comment,Didn't the CEO get a huge raise not too long ago?...,,12632,1758803334,2025,https://reddit.com/r/news/comments/1nq5cjp/starbucks_announces_significant_store_closures/
ng488er,r/news,media_public,comment,"I feel like Starbucks biggest problem is they're almost too saturated in parts. We have like 2 or 3 stand alone Starbucks shops near me in my small town. One of them gets ALL the business, like, literal fricking lines to pull into their terrible parking lot every morning. Meanwhile, I don't believe the other ones get hardly any business in comparison. Then, of course, they've got Starbucks within several stores around here such as like Target.",,687,1758804026,2025,https://reddit.com/r/news/comments/1nq5cjp/starbucks_announces_significant_store_closures/
ng48zk4,r/news,media_public,comment,"All while their CEO is one of the highest paid CEOs. 95 million dollar salary. He makes 20 million MORE than Tim Cook. Starbucks coffee is overpriced and overrated. I haven't had their crap in a long while, unless it was a gift or something.",,2741,1758804294,2025,https://reddit.com/r/news/comments/1nq5cjp/starbucks_announces_significant_store_closures/
1lx758s,r/news,media_public,post,LGBTQ+ suicide hotline workers in NY and NJ face layoffs after federal funding cut,LGBTQ+ suicide hotline workers in NY and NJ face layoffs after federal funding cut,1965,1752241099,2025,https://reddit.com/r/news/comments/1lx758s/lgbtq_suicide_hotline_workers_in_ny_and_nj_face/
n2jql32,r/news,media_public,comment,"Like many other posts here … I’ve been terminated from my position due to the federal cuts to SAMHSA.. this is bleak. … I am a contracted worker for NYS Office of Addiction Services and Supports. Heard the news early this week and finally received more clarification today. My position will be funded through June 20. Although I am out of a job, I am EXTREMELY grateful they were able to buy me some time in my current position. I just wanted to say, my heart is with my colleagues in this field and even more so with the communities that will be hit with the devastating realities of these funding cuts ❤️",,251,1752241195,2025,https://reddit.com/r/news/comments/1lx758s/lgbtq_suicide_hotline_workers_in_ny_and_nj_face/
n2jrqjy,r/news,media_public,comment,Tax cuts for the richest at the expense of the most vulnerable in this country - it’s the Republican way.,,162,1752241553,2025,https://reddit.com/r/news/comments/1lx758s/lgbtq_suicide_hotline_workers_in_ny_and_nj_face/
n2m0uvs,r/news,media_public,comment,Is there a place to volunteer to help?,,10,1752264844,2025,https://reddit.com/r/news/comments/1lx758s/lgbtq_suicide_hotline_workers_in_ny_and_nj_face/
n2k7xvb,r/news,media_public,comment,"&gt;More than 1 million people have used the LGBTQ+ line since it launched in 2022, Seems like worthy cause for my fellow Americans and $33 mill is rather cheap to fund...that's not even half of Trump's annual golfing budget. But some terrified idiots would rather throw an extra $45 billion at ICE so they can detain 6 year old kids with leukemia...shitting your pants over that, so brave and alpha. Screaming ""it's about mental health, not guns"" every time there's a shooting, but then gutting any kind of mental health assistance. I thought we were putting America (and Americans) first?",,31,1752246296,2025,https://reddit.com/r/news/comments/1lx758s/lgbtq_suicide_hotline_workers_in_ny_and_nj_face/
n2jse1s,r/news,media_public,comment,"Here's one more thing the ""I need something to vote FOR, not just AGAINST"" people could have voted for.",,32,1752241752,2025,https://reddit.com/r/news/comments/1lx758s/lgbtq_suicide_hotline_workers_in_ny_and_nj_face/
1luz0ey,r/news,media_public,post,Supreme Court lets Trump resume plans for mass federal layoffs,Supreme Court lets Trump resume plans for mass federal layoffs,11065,1752005620,2025,https://reddit.com/r/news/comments/1luz0ey/supreme_court_lets_trump_resume_plans_for_mass/
n224cr3,r/news,media_public,comment,"So we have a dictatorship then? If law can be overruled with an EO then he literally can dictate everything, the legislative branch is now a vestigial remnant. Used to serve a function but is now about as useful as a tailbone.",,7604,1752009044,2025,https://reddit.com/r/news/comments/1luz0ey/supreme_court_lets_trump_resume_plans_for_mass/
n228qc9,r/news,media_public,comment,The National Book Festival in DC announced their schedule today and Amy Coney Barrett is the headliner. Can’t wait for the reception she’ll get from the crowd.,,780,1752010300,2025,https://reddit.com/r/news/comments/1luz0ey/supreme_court_lets_trump_resume_plans_for_mass/
n229oin,r/news,media_public,comment,"SCOTUS isn’t a court anymore, it’s a corrupt GOP tool laundering billionaire bribes into constitutional destruction.",,1939,1752010578,2025,https://reddit.com/r/news/comments/1luz0ey/supreme_court_lets_trump_resume_plans_for_mass/
n22381o,r/news,media_public,comment,This SCOTUS is just as culpable and deadly as the administration.,,2118,1752008731,2025,https://reddit.com/r/news/comments/1luz0ey/supreme_court_lets_trump_resume_plans_for_mass/
n223xyu,r/news,media_public,comment,The government is going to be so broken by the time he leaves office. It's sad to watch.,,1148,1752008930,2025,https://reddit.com/r/news/comments/1luz0ey/supreme_court_lets_trump_resume_plans_for_mass/
1l768ix,r/news,media_public,post,"Thousands of veterans rally at National Mall to protest federal layoffs, cuts to services","Thousands of veterans rally at National Mall to protest federal layoffs, cuts to services",5967,1749479272,2025,https://reddit.com/r/news/comments/1l768ix/thousands_of_veterans_rally_at_national_mall_to/
mwu7xgl,r/news,media_public,comment,"The People are literally being stolen from. You may agree with government services or not, but you paid for them and are now not getting them. Instead it goes to billionaire tax breaks.",,546,1749480363,2025,https://reddit.com/r/news/comments/1l768ix/thousands_of_veterans_rally_at_national_mall_to/
mwumyme,r/news,media_public,comment,They didn't have the decency to die so the government doesn't care about them.,,163,1749484652,2025,https://reddit.com/r/news/comments/1l768ix/thousands_of_veterans_rally_at_national_mall_to/
mwusuwn,r/news,media_public,comment,"Right wingers are calling this an ""insurrection"" lmao",,76,1749486340,2025,https://reddit.com/r/news/comments/1l768ix/thousands_of_veterans_rally_at_national_mall_to/
mwvm9ne,r/news,media_public,comment,"My father, an 87 year old Air Force veteran with several health issues including being an amputee, was on the VA Home Care Program. It was great for disabled veterans that couldn't get to their local VA hospitals. They even gave him a blood pressure monitor to use at home that would upload his readings every day. A few weeks ago the nurse that manages the program in our area called to say that he was being removed, along with 150 or so other veterans in our area due to DOGE cutbacks. She also lost her job. It's an absolute disgrace and we should all be furious at this complete failure of an administration.",,58,1749494447,2025,https://reddit.com/r/news/comments/1l768ix/thousands_of_veterans_rally_at_national_mall_to/
1ksqq2r,r/news,media_public,post,"US filings for jobless aid, a proxy for layoffs, inch down modestly last week","US filings for jobless aid, a proxy for layoffs, inch down modestly last week",689,1747920560,2025,https://reddit.com/r/news/comments/1ksqq2r/us_filings_for_jobless_aid_a_proxy_for_layoffs/
mtnhoew,r/news,media_public,comment,"Fed chair Jerome Powell said the potential for both higher unemployment and inflation are elevated, an unusual combination that complicates the central bank’s dual mandate of controlling prices and keeping unemployment low.",,142,1747920620,2025,https://reddit.com/r/news/comments/1ksqq2r/us_filings_for_jobless_aid_a_proxy_for_layoffs/
mto79vh,r/news,media_public,comment,"Give it 3 weeks, there are massive layoffs happening right now. Advertising is a litmus test because they depend on brands, and brands depend on sales. When sales slump, they fire agencies and everyone dedicated to those accounts get the boot. I got laid off in Jan, and there was another big wave in early May. TikTok social commerce team just canned 20-30% of their staff as revenue drops from a slow Q1.",,195,1747928305,2025,https://reddit.com/r/news/comments/1ksqq2r/us_filings_for_jobless_aid_a_proxy_for_layoffs/
mto08gb,r/news,media_public,comment,"I once again want to remind people that most economic changes take months and years to happen. We can only speculate what the effect on the economy will be under Trump. Its obviously going to be bad long term but people thinking were about to collapse are misguided. That's not really how things happen. We're in for a long period of stagnation and probably a prolonged recession as the buying power of the lower and middle classes is eroded. People are still able to find work so spending is keeping thing afloat. Bad policy will catch up to us all, but it probably won't come for a year or two.",,117,1747926274,2025,https://reddit.com/r/news/comments/1ksqq2r/us_filings_for_jobless_aid_a_proxy_for_layoffs/
mtpyii5,r/news,media_public,comment,Two friends of mine just had their companies cut by 20% this week.,,9,1747946541,2025,https://reddit.com/r/news/comments/1ksqq2r/us_filings_for_jobless_aid_a_proxy_for_layoffs/
mtnmwtk,r/news,media_public,comment,Walmart just announced layoffs today. The end is nigh.,,44,1747922301,2025,https://reddit.com/r/news/comments/1ksqq2r/us_filings_for_jobless_aid_a_proxy_for_layoffs/
1kaxfvh,r/news,media_public,post,"FDA to undo some layoffs, after cuts to inspections and drug safety","FDA to undo some layoffs, after cuts to inspections and drug safety",4002,1745956964,2025,https://reddit.com/r/news/comments/1kaxfvh/fda_to_undo_some_layoffs_after_cuts_to/
mppx31y,r/news,media_public,comment,"Even if you’re the sort of person who supports these cost cutting efforts, how can you not be embarrassed that the party you voted in are so fucking bad at their jobs? As someone on the other side, it’s hilarious watching these idiots fail to tie their own shoe laces, but if I was a GOP voter, I’d be furious that my master had hired such complete buffoons.",,542,1745957373,2025,https://reddit.com/r/news/comments/1kaxfvh/fda_to_undo_some_layoffs_after_cuts_to/
mppza8s,r/news,media_public,comment,"What do you mean ""undo""? This isn't a fucking Word document, some of these guys probably already moved on and said ""fuck it and fuck the government"". You can't just go around and fuck people's lives then hit ctrl-z and call it a day. Bunch of clowns running this country.",,146,1745957999,2025,https://reddit.com/r/news/comments/1kaxfvh/fda_to_undo_some_layoffs_after_cuts_to/
mppw19f,r/news,media_public,comment,What a fucking shit show. Hope we at least get some of those cheap groceries we were promised.,,790,1745957078,2025,https://reddit.com/r/news/comments/1kaxfvh/fda_to_undo_some_layoffs_after_cuts_to/
mppwy03,r/news,media_public,comment,Now if only someone had actually taken the fucking time to make sure vital functions weren't being affected before rubbing one out from the giant throbbing erection they got from a session of seig heil salutes.,,278,1745957334,2025,https://reddit.com/r/news/comments/1kaxfvh/fda_to_undo_some_layoffs_after_cuts_to/
mpq052m,r/news,media_public,comment,Trump is doing the one thing that could hurt the Republican brand the most. Showing people that the government actually does a lot of important things,,67,1745958243,2025,https://reddit.com/r/news/comments/1kaxfvh/fda_to_undo_some_layoffs_after_cuts_to/
