id,subreddit,label,type,text,title,score,created_utc,time_period,url
edd07kt,r/news,media_public,comment,"When they had some lay offs at UP HQ in Omaha someone went into the empty lot next door and wrote in big letters in the snow ""Why dont you lay off the coke Lance?(name of CEO)"" It's too bad it doesnt snow in Roseville.",,10,1546752085,other,https://reddit.com/r/news/comments/acvct1/union_pacific_announces_475_workforce_layoffs/
edb6ka3,r/news,media_public,comment,"These are administrative positions, mostly clerks and the like. None of these layoffs affect train operations, track maintenance, or signal personnel. The Roseville facility should be minimally affected.",,52,1546707559,other,https://reddit.com/r/news/comments/acvct1/union_pacific_announces_475_workforce_layoffs/
edbo1m1,r/news,media_public,comment,"Automation is taking over the rail industry today. In Australia, they are now running trains hundreds of miles without human intervention.",,8,1546718805,other,https://reddit.com/r/news/comments/acvct1/union_pacific_announces_475_workforce_layoffs/
edbl7ba,r/news,media_public,comment,This is a company that had a net income of more than $10 billion last year...,,1,1546716898,other,https://reddit.com/r/news/comments/acvct1/union_pacific_announces_475_workforce_layoffs/
edd7yfn,r/news,media_public,comment,And how much did Union Pacific get from the tax break?,,1,1546759929,other,https://reddit.com/r/news/comments/acvct1/union_pacific_announces_475_workforce_layoffs/
a9xxx6,r/news,media_public,post,'A kick in the stomach': massive GM layoffs leave workers distraught,'A kick in the stomach': massive GM layoffs leave workers distraught,540,1545904447,other,https://reddit.com/r/news/comments/a9xxx6/a_kick_in_the_stomach_massive_gm_layoffs_leave/
ecnfcmi,r/news,media_public,comment,"Wait, the new, improved, taxpayer saved GM doesn’t have workers interests at heart?",,325,1545910667,other,https://reddit.com/r/news/comments/a9xxx6/a_kick_in_the_stomach_massive_gm_layoffs_leave/
eco4hd9,r/news,media_public,comment,"&gt;Adams says GM is making a strategic mistake by ending US production of the Cruze and several other sedans: the Chevy Impala, Chevy Volt and Buick LaCrosse. “GM had the perfect opportunity to say, ‘We are the only American car manufacturing company that is building cars in the USA.’ They could have been like Harley-Davidson. Isn't H-D moving their production to other countries too?",,61,1545931185,other,https://reddit.com/r/news/comments/a9xxx6/a_kick_in_the_stomach_massive_gm_layoffs_leave/
ecnqino,r/news,media_public,comment,When will people learn that corporations don't have their workers or people's interests in mind? Like we've been burned and abused many times and we don't learn our lesson.,,124,1545921375,other,https://reddit.com/r/news/comments/a9xxx6/a_kick_in_the_stomach_massive_gm_layoffs_leave/
eco8yzg,r/news,media_public,comment,Welcome to the Chevy Family,,14,1545934856,other,https://reddit.com/r/news/comments/a9xxx6/a_kick_in_the_stomach_massive_gm_layoffs_leave/
ecoao4t,r/news,media_public,comment,We bailed these assholes out how many times? Fucking liquidate this garbage company already.,,16,1545936257,other,https://reddit.com/r/news/comments/a9xxx6/a_kick_in_the_stomach_massive_gm_layoffs_leave/
a3ae9q,r/news,media_public,post,24-70 layoffs expected at Erie's Amthor Steel,24-70 layoffs expected at Erie's Amthor Steel,33,1543998048,other,https://reddit.com/r/news/comments/a3ae9q/2470_layoffs_expected_at_eries_amthor_steel/
eb4y445,r/news,media_public,comment,"This is kind of strange. With the protective tariffs in place, steel manufacturers should be having a banner year.",,5,1544016985,other,https://reddit.com/r/news/comments/a3ae9q/2470_layoffs_expected_at_eries_amthor_steel/
eb51u7x,r/news,media_public,comment,Trump bringing back those jobs.,,1,1544020299,other,https://reddit.com/r/news/comments/a3ae9q/2470_layoffs_expected_at_eries_amthor_steel/
eb4meow,r/news,media_public,comment,Teamster here. Just a slimy corporate dick up your ass move. Stand strong.,,3,1543999960,other,https://reddit.com/r/news/comments/a3ae9q/2470_layoffs_expected_at_eries_amthor_steel/
9yup9v,r/news,media_public,post,General Motors wanted at least 7K workers to take a buyout; layoffs loom,General Motors wanted at least 7K workers to take a buyout; layoffs loom,112,1542737725,other,https://reddit.com/r/news/comments/9yup9v/general_motors_wanted_at_least_7k_workers_to_take/
ea4t4mb,r/news,media_public,comment,"*""rising prices of raw material""* I wonder why.",,35,1542755741,other,https://reddit.com/r/news/comments/9yup9v/general_motors_wanted_at_least_7k_workers_to_take/
ea49uaa,r/news,media_public,comment,"There’s no financial benefit to the buyout so people aren’t taking it. &gt;The buyout packages include six months pay and six months of health care coverage, the GM spokesman confirmed. Those who opt to take the buyout have until the end of the year to continue with GM, with severance effective Jan. 1. &gt;The six-month pay and six-month health care is the same severance a GM employee with 12 years or more experience would receive if they were involuntarily terminated, GM employees said. That’s why some inside the company say interest in the buyout has been lukewarm. &gt;One employee who works on interior components said about 90 people in that department qualify for a buyout. By the end of last week only two signed up to take it, said the employees.",,28,1542740511,other,https://reddit.com/r/news/comments/9yup9v/general_motors_wanted_at_least_7k_workers_to_take/
ea5g61d,r/news,media_public,comment,I doubt it has much to do with rising material cost and more to do with wanting a cheaper labor force and the shit tier sales gm has been having.,,7,1542779688,other,https://reddit.com/r/news/comments/9yup9v/general_motors_wanted_at_least_7k_workers_to_take/
ea5eblt,r/news,media_public,comment,"This is ""new"" GM. The original company was dissolved after chapter 7 bankruptcy.",,4,1542777311,other,https://reddit.com/r/news/comments/9yup9v/general_motors_wanted_at_least_7k_workers_to_take/
ea4pzcw,r/news,media_public,comment,"Another example of how your Employer is NOT your friend They'll say this one moment: &gt;""Nobody’s under pressure to sign up or fear they’ll be threatened with firing or termination if they don’t sign up,"" said a former senior-level GM manager who spoke with several employees who attended the meetings. And then this: &gt;“GM (leaders) haven’t decided what they’re going to do if there is a shortfall — if they don’t hit 7,000,"" said the source. **""They said they may start the process in mid-January for involuntary releases.”**",,15,1542752983,other,https://reddit.com/r/news/comments/9yup9v/general_motors_wanted_at_least_7k_workers_to_take/
9vs7bq,r/news,media_public,post,Lost VA contract leads to layoffs at local BlueCross BlueShield,Lost VA contract leads to layoffs at local BlueCross BlueShield,36,1541831164,other,https://reddit.com/r/news/comments/9vs7bq/lost_va_contract_leads_to_layoffs_at_local/
9p0dc7,r/news,media_public,post,Drug giant Pfizer offers early retirement ahead of layoffs in memo to employees,Drug giant Pfizer offers early retirement ahead of layoffs in memo to employees,32,1539794837,other,https://reddit.com/r/news/comments/9p0dc7/drug_giant_pfizer_offers_early_retirement_ahead/
e7y9j7f,r/news,media_public,comment,"Look, no one likes layoffs, but if they are offering pretty lucrative early retirement to those that will offer the best relief for the company, it is what it is. Drug profits will eventually go down, maybe sooner than later, and looking at single year profits for a company that takes 20 years of losses to develop a drug is a bit shortsighted as well",,16,1539802241,other,https://reddit.com/r/news/comments/9p0dc7/drug_giant_pfizer_offers_early_retirement_ahead/
e7y1att,r/news,media_public,comment,hedging it's bets for an economic downturn in the future.,,4,1539795593,other,https://reddit.com/r/news/comments/9p0dc7/drug_giant_pfizer_offers_early_retirement_ahead/
9ge6fu,r/news,media_public,post,"Layoffs hit, prices lag as tariff pinches lobster industry","Layoffs hit, prices lag as tariff pinches lobster industry",776,1537131971,other,https://reddit.com/r/news/comments/9ge6fu/layoffs_hit_prices_lag_as_tariff_pinches_lobster/
e63k83y,r/news,media_public,comment,Time to add lobster to my diet.,,168,1537135188,other,https://reddit.com/r/news/comments/9ge6fu/layoffs_hit_prices_lag_as_tariff_pinches_lobster/
e63r7lg,r/news,media_public,comment,"I’m from Maine. Lobstering is a seasonal business any way. They normally do layoffs so that the guys can take (a lot) of money go home and collect over the winter and come back in the spring. Not something caused by tariffs, happens every year.",,80,1537141672,other,https://reddit.com/r/news/comments/9ge6fu/layoffs_hit_prices_lag_as_tariff_pinches_lobster/
e640sq0,r/news,media_public,comment,So are we not gonna talk about the ridiculous pun in the article’s title?,,34,1537151285,other,https://reddit.com/r/news/comments/9ge6fu/layoffs_hit_prices_lag_as_tariff_pinches_lobster/
e652j2p,r/news,media_public,comment,I love how us New Englanders all came in to call bullshit,,6,1537202649,other,https://reddit.com/r/news/comments/9ge6fu/layoffs_hit_prices_lag_as_tariff_pinches_lobster/
99ygyb,r/news,media_public,post,"Wells Fargo gives layoff notices to 137 in Orlando, 638 nationwide","Wells Fargo gives layoff notices to 137 in Orlando, 638 nationwide",62,1535125262,other,https://reddit.com/r/news/comments/99ygyb/wells_fargo_gives_layoff_notices_to_137_in/
e4rfi1z,r/news,media_public,comment,638 nationwide is a remarkably small number to have an article about it....~262k employees....,,26,1535128895,other,https://reddit.com/r/news/comments/99ygyb/wells_fargo_gives_layoff_notices_to_137_in/
e4rzhiy,r/news,media_public,comment,Can't believe they are still in bussiness.,,2,1535146124,other,https://reddit.com/r/news/comments/99ygyb/wells_fargo_gives_layoff_notices_to_137_in/
e4szncz,r/news,media_public,comment,"If only Wells Fargo would wither up and die for all the shit they pulled in their Institutional Lending group in Edina, MN from 1999-2003. People should really be in jail at this point. Too bad Wells is so good at threatening whistle blowers with lawyers.",,2,1535197008,other,https://reddit.com/r/news/comments/99ygyb/wells_fargo_gives_layoff_notices_to_137_in/
e4rdare,r/news,media_public,comment,[CEO made 17 million last year](,,7,1535127040,other,https://reddit.com/r/news/comments/99ygyb/wells_fargo_gives_layoff_notices_to_137_in/
8xwojd,r/news,media_public,post,More than 200 layoffs at TEC Industrial in Kingsport,More than 200 layoffs at TEC Industrial in Kingsport,5,1531284726,other,https://reddit.com/r/news/comments/8xwojd/more_than_200_layoffs_at_tec_industrial_in/
e26d1ht,r/news,media_public,comment,"This is one of mamy tremors b4 the economic quake that is coming. The co. I work for has stopped hiring effective immediately and spending has been stopped. A very large tech Co. Housing in my area has seen purchases drop and supply up not only since the spring but year on year. Interest rates going up, housing prices continue up but slowing, banks are lowering the necessary down payment to keep new loans moving, 10 and 2 year bonds yield spread are nearing each other as has happened prior to economic recessions, tariffs on economic trading partners, trade war with China, possibly pulling out of WTO, Brexit about to fall apart, UN releases 40% of Americans have less than 400$ in their accounts, avg American debt is higher than prior to 2008 crash... it is coming, and this time no govt monies to bail us out (tax cuts taken care of that.) Hang on folks, gonna get crazy. I give it a year and a half or less before the sh1t hits the fan.",,1,1531287292,other,https://reddit.com/r/news/comments/8xwojd/more_than_200_layoffs_at_tec_industrial_in/
1npfo1x,r/news,media_public,post,Trump administration rehires hundreds of federal employees laid off by DOGE,Trump administration rehires hundreds of federal employees laid off by DOGE,38646,1758728766,2025,https://reddit.com/r/news/comments/1npfo1x/trump_administration_rehires_hundreds_of_federal/
nfyxzpv,r/news,media_public,comment,"If [Trump was right about everything]( and he fired thousands of federal employees, then how can he be right about everything and rehire so many back?",,9481,1758730500,2025,https://reddit.com/r/news/comments/1npfo1x/trump_administration_rehires_hundreds_of_federal/
nfyxu8u,r/news,media_public,comment,"Apparently ""government efficiency"" and ""the chainsaw approach"" aren't really compatible.",,5589,1758730457,2025,https://reddit.com/r/news/comments/1npfo1x/trump_administration_rehires_hundreds_of_federal/
nfyx3vn,r/news,media_public,comment,"I'm sure at zero cost to the taxpayer, right?... Right?",,2385,1758730246,2025,https://reddit.com/r/news/comments/1npfo1x/trump_administration_rehires_hundreds_of_federal/
nfyz7xh,r/news,media_public,comment,"&gt; DOGE’s “Wall of Receipts,” which once boasted that the lease cancellations alone would save nearly $460 million, has since reduced that estimate to $140 million by the end of July - &gt; Meanwhile, GSA embarked on massive job cuts. The administration slashed GSA’s headquarters staff by 79%, its portfolio managers by 65% and facilities managers by 35% - &gt; As a result of the internal turmoil, 131 leases expired without the government actually vacating the properties, the official said. The situation has exposed the agencies to steep fees because property owners have not been able to rent out those spaces to other tenants. Not only did they not save as much money as they originally ""estimated"", DOGE exposed the government to fees that they would have avoided if they hadn't ""taken a chainsaw"" to our agencies. And all that on top of the fact that Elon Musk still receives billions in subsidies for his companies, and any savings DOGE claims to make, even their highest estimates, pale in comparison.",,525,1758730852,2025,https://reddit.com/r/news/comments/1npfo1x/trump_administration_rehires_hundreds_of_federal/
1npesah,r/news,media_public,post,US administration rehires hundreds of federal employees laid off by DOGE,US administration rehires hundreds of federal employees laid off by DOGE,2341,1758726751,2025,https://reddit.com/r/news/comments/1npesah/us_administration_rehires_hundreds_of_federal/
ng0ptlv,r/news,media_public,comment,Republicans love to waste everyone's time.,,897,1758749085,2025,https://reddit.com/r/news/comments/1npesah/us_administration_rehires_hundreds_of_federal/
ng0q95i,r/news,media_public,comment,"It's all performative but what did we expect, half the executive branch resumes are TV related.",,200,1758749219,2025,https://reddit.com/r/news/comments/1npesah/us_administration_rehires_hundreds_of_federal/
ng0qbvj,r/news,media_public,comment,I wonder how much money we didn't save.,,164,1758749242,2025,https://reddit.com/r/news/comments/1npesah/us_administration_rehires_hundreds_of_federal/
ng0rpr6,r/news,media_public,comment,"Fuck it, I take it back. Elon IS even more worthless than Nutlick.",,82,1758749677,2025,https://reddit.com/r/news/comments/1npesah/us_administration_rehires_hundreds_of_federal/
ng0swd7,r/news,media_public,comment,Boy was that efficient.,,37,1758750054,2025,https://reddit.com/r/news/comments/1npesah/us_administration_rehires_hundreds_of_federal/
11lcfvi,r/news,media_public,post,Elon Musk publicly mocks Twitter worker with disability who is unsure whether he's been laid off,Elon Musk publicly mocks Twitter worker with disability who is unsure whether he's been laid off,75542,1678225579,2023,https://reddit.com/r/news/comments/11lcfvi/elon_musk_publicly_mocks_twitter_worker_with/
jbc9uq9,r/news,media_public,comment,He’s not just any employee. He’s the founder of a company Twitter acquired and has a very specific contract to keep him on staff instead of a typical buyout.,,10105,1678234993,2023,https://reddit.com/r/news/comments/11lcfvi/elon_musk_publicly_mocks_twitter_worker_with/
jbc5x1r,r/news,media_public,comment,"""I would like to apologize to Halli for my misunderstanding of his situation. It was based on things I was told that were untrue or, in some cases, true, but not meaningful. He is considering remaining at Twitter."" [ is this real life",,4769,1678233266,2023,https://reddit.com/r/news/comments/11lcfvi/elon_musk_publicly_mocks_twitter_worker_with/
jbc4k5w,r/news,media_public,comment,"&gt;Twitter, which has cut much of its public relations department, also did not respond. Never gets old 🤣",,11771,1678232671,2023,https://reddit.com/r/news/comments/11lcfvi/elon_musk_publicly_mocks_twitter_worker_with/
jbbpai9,r/news,media_public,comment,"It doesn't end there. This guy's employment contract was basically taking a job and wages in lieu of stock/cash for having sold his company to Twitter. If he's fired, he's owed compensation still under his contract. LMAO",,20872,1678226328,2023,https://reddit.com/r/news/comments/11lcfvi/elon_musk_publicly_mocks_twitter_worker_with/
jbcgvml,r/news,media_public,comment,"Employment and disability lawyers salivating about a boss publicly revealing a confidential disability, publicly announcing he disbelieves it and that he's being fired for having the disability.",,600,1678238190,2023,https://reddit.com/r/news/comments/11lcfvi/elon_musk_publicly_mocks_twitter_worker_with/
yo5rlx,r/news,media_public,post,"Twitter asks some laid off workers to come back, Bloomberg reports","Twitter asks some laid off workers to come back, Bloomberg reports",40433,1667775929,2022,https://reddit.com/r/news/comments/yo5rlx/twitter_asks_some_laid_off_workers_to_come_back/
ivcpopm,r/news,media_public,comment,"&gt; Tweets by staff of the social media company said teams responsible for communications … were among those gutted… &gt; …Twitter did not immediately respond to Reuters' request for comment. I mean, I guess that makes perfect sense?",,9442,1667779901,2022,https://reddit.com/r/news/comments/yo5rlx/twitter_asks_some_laid_off_workers_to_come_back/
ivcmjyf,r/news,media_public,comment,"Reminds of a time when a bank decided they needed to be younger and more agile. Rather than updating their core banking systems (mainframe systems written in cobol in the 1970s), they let go anyone over the age of 50 who wasn't a manager or above. Took them a month of not getting board reports to figure out that the only IT guys who could still code in Cobol, were all just let go. They tried to get them back, but they all refused since their retrenchment package was great (2 weeks pay for each year of service, and most had been there 30+ years). Eventually a few relented and came back as consultants. I hope they charged ridiculous rates.",,4954,1667778510,2022,https://reddit.com/r/news/comments/yo5rlx/twitter_asks_some_laid_off_workers_to_come_back/
ivcibzf,r/news,media_public,comment,"Whenever I take a new position I certainly expect a raise. Especially since I would be such a perfect fit for the job they’re looking for, a significant raise. And as this company that is trying to hire me has a track record of, really REALLY fucking me over, it needs to be a really REALLY significant raise.",,3630,1667776703,2022,https://reddit.com/r/news/comments/yo5rlx/twitter_asks_some_laid_off_workers_to_come_back/
ivcivxs,r/news,media_public,comment,I’m certain they’ll be back to the office tomorrow post-haste and definitely won’t be harboring any ill feelings towards the company or tweeting anything that may reflect negatively on their experience. Or they may do like the rest of us and say ByeTwitter.,,4368,1667776938,2022,https://reddit.com/r/news/comments/yo5rlx/twitter_asks_some_laid_off_workers_to_come_back/
ivch0tb,r/news,media_public,comment,"""Some of those who are being asked to return were laid off by mistake. Others were let go before management realized that their work and experience may be necessary to build the new features Musk envision"" I'd say you fire the idiot who decided to fire them in the first place.",,14361,1667776145,2022,https://reddit.com/r/news/comments/yo5rlx/twitter_asks_some_laid_off_workers_to_come_back/
sa761l,r/news,media_public,post,"Before Recent Wave of Train Cargo Thefts, Union Pacific Laid Off Unspecified Number of Its Railroad Police Force","Before Recent Wave of Train Cargo Thefts, Union Pacific Laid Off Unspecified Number of Its Railroad Police Force",4269,1642871807,2022,https://reddit.com/r/news/comments/sa761l/before_recent_wave_of_train_cargo_thefts_union/
httxgp0,r/news,media_public,comment,"Per the article: “According to the source, the number of patrolling officers has been cut from 50 to 60 agents to eight, which the worker thinks has led to an increase in train robberies.”",,90,1642907166,2022,https://reddit.com/r/news/comments/sa761l/before_recent_wave_of_train_cargo_thefts_union/
htrnana,r/news,media_public,comment,"Well that didn't work out well, they need to ""layoff"" whoever made that decision.",,843,1642873470,2022,https://reddit.com/r/news/comments/sa761l/before_recent_wave_of_train_cargo_thefts_union/
httimeg,r/news,media_public,comment,"Yep. And, the company posted great profits after laying off their security staff. Union Pacific should pay for more security and also pay for the pilfered items. Yes, cut the exec's pay!",,80,1642900729,2022,https://reddit.com/r/news/comments/sa761l/before_recent_wave_of_train_cargo_thefts_union/
htrvmou,r/news,media_public,comment,Imagine laying off your security guards at a time when income inequality in America is higher than France during the French Revolution… And the worst part is all these companies have increased CEO bonuses and passed increased costs onto consumers in the name of “supply chain / inflation” but keep cutting costs and maximizing profits more than ever before. 2022 coming in spicy.,,378,1642876700,2022,https://reddit.com/r/news/comments/sa761l/before_recent_wave_of_train_cargo_thefts_union/
k6u79p,r/news,media_public,post,More than 75 employees laid off as Decker coal mine owner files for bankruptcy,More than 75 employees laid off as Decker coal mine owner files for bankruptcy,179,1607117958,2020,https://reddit.com/r/news/comments/k6u79p/more_than_75_employees_laid_off_as_decker_coal/
gen0s5p,r/news,media_public,comment,This is going to be a thing in the coming years. I hope these workers see it coming and find jobs before it does.,,53,1607118530,2020,https://reddit.com/r/news/comments/k6u79p/more_than_75_employees_laid_off_as_decker_coal/
genfq6w,r/news,media_public,comment,"Trump will save the coal industry, Mexico will pay for the wall, Covid is a hoax......",,22,1607126742,2020,https://reddit.com/r/news/comments/k6u79p/more_than_75_employees_laid_off_as_decker_coal/
gen3mxm,r/news,media_public,comment,Coal is coming back guys! The next Republican will tell you the same. The one after that will tell you the same thing. They will all blame regulations and or Democrats as the cause. These coal companies have no problem dumping their toxic by products into your communities. They'll also lay you off before they lose any profit. Keep voting for the same thing because that will certainly help you.,,29,1607120039,2020,https://reddit.com/r/news/comments/k6u79p/more_than_75_employees_laid_off_as_decker_coal/
genepux,r/news,media_public,comment,"A typical Walmart has 45 employees working in it every day. Average supermarkets have 40 per store. Average Costco, around 50. Now, I'm not saying it isn't bad that these people have lost their employment in the middle of a pandemic, but the sheer number of resources that multiple administrations, agencies and groups have attempted to give these people to transition their careers, which have been met with ardent opposition is staggering. At this point, I really have a hard time finding a violin small enough to play as this dinosaur (no pun intended) of an industry ceases to be. I've always been shocked that no Presidential administration has pushed to morph the coal sector businesses and jobs into a sort of roving infrastructure crew that could be deployed to add skilled manpower and equipment to various state and municipal DOTs around the country to aid rapid infrastructure repairs and build-outs and to perform disaster recovery reconstruction. The capital equipment owned by these companies, combined with the skill-set required seems like a perfect match for the folks doing heavy equipment operations, explosive demolition, and underground construction already.",,19,1607126157,2020,https://reddit.com/r/news/comments/k6u79p/more_than_75_employees_laid_off_as_decker_coal/
genfi2b,r/news,media_public,comment,"I sincerely hope we as a nation take care of the few thousand miners whose jobs have been phased out and allow them to pick new careers, get the training they need to succeed, and know that we as a society are gonna be there to make sure their families are ok. Of course we will probably just give the mine owners million dollars grants because they made campaign contributions and leave the abandoned mine infrastructure there to pollute the surrounding area and kill future generations of miners kids to suffer and die in poverty, but hey, capitalism is greatest, right?",,8,1607126608,2020,https://reddit.com/r/news/comments/k6u79p/more_than_75_employees_laid_off_as_decker_coal/
jeo5j3,r/news,media_public,post,Star Wars: Galaxy's Edge Cast Members at Disneyland Being Laid Off Due to Non-Transferable Seniority,Star Wars: Galaxy's Edge Cast Members at Disneyland Being Laid Off Due to Non-Transferable Seniority,753,1603195564,2020,https://reddit.com/r/news/comments/jeo5j3/star_wars_galaxys_edge_cast_members_at_disneyland/
