id,subreddit,label,type,text,title,score,created_utc,time_period,url
yfva0s,r/news,media_public,post,Departing Twitter employees say layoffs have started as Elon Musk takes over,Departing Twitter employees say layoffs have started as Elon Musk takes over,9960,1666978714,2022,https://reddit.com/r/news/comments/yfva0s/departing_twitter_employees_say_layoffs_have/
iu5dr48,r/news,media_public,comment,I've been out of the loop completely. Why does he even want Twitter so much?,,1138,1666979527,2022,https://reddit.com/r/news/comments/yfva0s/departing_twitter_employees_say_layoffs_have/
iu5f3fv,r/news,media_public,comment,He's got to make enough money to make those $1bn interest payments each year. I think Twitter's income last year was negative $220m. So... good luck!,,587,1666980069,2022,https://reddit.com/r/news/comments/yfva0s/departing_twitter_employees_say_layoffs_have/
iu5vugo,r/news,media_public,comment,Milton is now having his desk moved to the basement,,90,1666986887,2022,https://reddit.com/r/news/comments/yfva0s/departing_twitter_employees_say_layoffs_have/
iu5cbgg,r/news,media_public,comment,"Elon Musk: I'm going to use the same ""AI"" from the tesla cars in order to keep watch over twitter.",,242,1666978945,2022,https://reddit.com/r/news/comments/yfva0s/departing_twitter_employees_say_layoffs_have/
xcn1pw,r/news,media_public,post,Goldman Sachs to kick off Wall Street layoff season with hundreds of job cuts this month,Goldman Sachs to kick off Wall Street layoff season with hundreds of job cuts this month,853,1663014086,2022,https://reddit.com/r/news/comments/xcn1pw/goldman_sachs_to_kick_off_wall_street_layoff/
io6wrbo,r/news,media_public,comment,"Annual bloodletting designed to create and maintain a backstabbing, cutthroat work environment.",,62,1663027554,2022,https://reddit.com/r/news/comments/xcn1pw/goldman_sachs_to_kick_off_wall_street_layoff/
io63yer,r/news,media_public,comment,"Once again the title conflicts with the article: &gt; The bank is reinstating a tradition of annual employee culls, which have historically targeted between 1% and 5% of lower performers, in positions across the firm, according to a person with direct knowledge of the situation. Not ""layoffs"". Actual management of poor performers.",,192,1663015238,2022,https://reddit.com/r/news/comments/xcn1pw/goldman_sachs_to_kick_off_wall_street_layoff/
io7yulo,r/news,media_public,comment,"Goldman Sachs is \~75,000 employees. ""Hundreds"" sounds like a lot but it'll turn out to be less than 2% of the company.",,8,1663045670,2022,https://reddit.com/r/news/comments/xcn1pw/goldman_sachs_to_kick_off_wall_street_layoff/
io7unda,r/news,media_public,comment,"“Hey, remember how we demanded you all come back into the office? lol jk!”",,7,1663043061,2022,https://reddit.com/r/news/comments/xcn1pw/goldman_sachs_to_kick_off_wall_street_layoff/
vtsnd3,r/news,media_public,post,"GameStop CFO is leaving the company, retailer announces layoffs","GameStop CFO is leaving the company, retailer announces layoffs",774,1657226846,2022,https://reddit.com/r/news/comments/vtsnd3/gamestop_cfo_is_leaving_the_company_retailer/
if9ucyg,r/news,media_public,comment,Oh man I should totally short GME,,306,1657236058,2022,https://reddit.com/r/news/comments/vtsnd3/gamestop_cfo_is_leaving_the_company_retailer/
if9hr2p,r/news,media_public,comment,"Not leaving, fired. There is a big difference. Layoffs are in legacy areas of the business and redundant positions.",,66,1657230647,2022,https://reddit.com/r/news/comments/vtsnd3/gamestop_cfo_is_leaving_the_company_retailer/
ifav9sq,r/news,media_public,comment,"They’re laying off some corporate people after hiring 600 people in the last year and doing aggressive restructuring, and are now set to start hiking pay and resources for retail employees. So it’s good news not potential toilet flush.",,33,1657252874,2022,https://reddit.com/r/news/comments/vtsnd3/gamestop_cfo_is_leaving_the_company_retailer/
if9e5mf,r/news,media_public,comment,How did anyone get nostalgia for such a shitty store. It wasn't Babbage's,,71,1657229139,2022,https://reddit.com/r/news/comments/vtsnd3/gamestop_cfo_is_leaving_the_company_retailer/
vh3902,r/news,media_public,post,Tesla sued by former employees over 'mass layoff',Tesla sued by former employees over 'mass layoff',1337,1655780862,2022,https://reddit.com/r/news/comments/vh3902/tesla_sued_by_former_employees_over_mass_layoff/
id5h5ki,r/news,media_public,comment,"Seems pretty straight forward. I had a look at the federal law and now I think I see why severance packages are a thing. Federal law says you have to give 60 days notice, but I bet if you fire them and tell them not to come back in when you ""give notice,"" but then give them a lump sum 2-month pay. It basically clears things up and skirts the law. Tesla fucked up by only giving 1 week severance.",,209,1655791218,2022,https://reddit.com/r/news/comments/vh3902/tesla_sued_by_former_employees_over_mass_layoff/
id51l0m,r/news,media_public,comment,"""It's pretty shocking that Tesla would just blatantly violate federal labor law by laying off so many workers without providing the required notice,"" Shannon Liss-Riordan, an attorney representing the workers told Reuters. Is it really?",,318,1655781166,2022,https://reddit.com/r/news/comments/vh3902/tesla_sued_by_former_employees_over_mass_layoff/
id5djgb,r/news,media_public,comment,"Constant lawsuits incoming. Massive drop in stock price. Moronic twitter ""deal"". Fires space x workers who complain about how much he sucks. Cars are claimed to be unsafe by NHTSA/MIT. Disrespected daughter is changing her name so shes not associated with him. Looks like the business ""genius"" kinda sucks at business (and being a father).",,122,1655788600,2022,https://reddit.com/r/news/comments/vh3902/tesla_sued_by_former_employees_over_mass_layoff/
id5ao1j,r/news,media_public,comment,[Elon Zorg fires 1 million](,,42,1655786630,2022,https://reddit.com/r/news/comments/vh3902/tesla_sued_by_former_employees_over_mass_layoff/
id6fhzg,r/news,media_public,comment,Sure Elon. It’s “trivial” that these people lost their jobs…,,6,1655817253,2022,https://reddit.com/r/news/comments/vh3902/tesla_sued_by_former_employees_over_mass_layoff/
vcawan,r/news,media_public,post,Real estate firms Compass and Redfin announce layoffs as housing market slows,Real estate firms Compass and Redfin announce layoffs as housing market slows,864,1655233467,2022,https://reddit.com/r/news/comments/vcawan/real_estate_firms_compass_and_redfin_announce/
icd4h48,r/news,media_public,comment,"The madness has to end sooner or later, please be sooner",,211,1655233813,2022,https://reddit.com/r/news/comments/vcawan/real_estate_firms_compass_and_redfin_announce/
icd5coy,r/news,media_public,comment,"Funny how just recently, realtors were saying ""this is the best time to buy!"" Yeah, no one is interested in shelling out half a million bucks for a derelict shanty (i.e. ""fixer-upper"")",,230,1655234175,2022,https://reddit.com/r/news/comments/vcawan/real_estate_firms_compass_and_redfin_announce/
icdexss,r/news,media_public,comment,This feels like the 100% expected outcome of the Fed raising interest rates to cut inflation?,,79,1655238154,2022,https://reddit.com/r/news/comments/vcawan/real_estate_firms_compass_and_redfin_announce/
icdbbg9,r/news,media_public,comment,Can't wait to see how the new Fed rates will impact the market.,,12,1655236641,2022,https://reddit.com/r/news/comments/vcawan/real_estate_firms_compass_and_redfin_announce/
tzfmd8,r/news,media_public,post,Tiger Woods makes cut at the Masters in extraordinary return following long injury layoff,Tiger Woods makes cut at the Masters in extraordinary return following long injury layoff,531,1649458618,2022,https://reddit.com/r/news/comments/tzfmd8/tiger_woods_makes_cut_at_the_masters_in/
i3yz1s3,r/news,media_public,comment,"I'll always have a soft spot in my heart for Tiger Woods. I remember watching him as a kid and going nuts when he would win. My dad loved when my siblings and I would watch golf with him, so those are some fond memories.",,76,1649462411,2022,https://reddit.com/r/news/comments/tzfmd8/tiger_woods_makes_cut_at_the_masters_in/
i3z3sl9,r/news,media_public,comment,"This is a great comeback and I'm happy for him. By the way, anyone ever heard of Stewart Cink? He got a fucking **hole in one today** but nobody knows about it because the only golf news being reported is about Tiger coming back.",,95,1649464636,2022,https://reddit.com/r/news/comments/tzfmd8/tiger_woods_makes_cut_at_the_masters_in/
i3z6857,r/news,media_public,comment,"Wow, I really didn't think he was going to be able to play professional golf again after his accident.",,31,1649465807,2022,https://reddit.com/r/news/comments/tzfmd8/tiger_woods_makes_cut_at_the_masters_in/
i3ztl27,r/news,media_public,comment,Best golfer of all time,,26,1649477481,2022,https://reddit.com/r/news/comments/tzfmd8/tiger_woods_makes_cut_at_the_masters_in/
i40yyt2,r/news,media_public,comment,Driving 90 mph in a neighborhood and people act like he beat cancer. He was probably intoxicated like his last crash too.,,21,1649507276,2022,https://reddit.com/r/news/comments/tzfmd8/tiger_woods_makes_cut_at_the_masters_in/
nqpqic,r/news,media_public,post,"Air Canada’s $10 million in bonuses for management is ‘morally bankrupt’ after mass layoffs, says union","Air Canada’s $10 million in bonuses for management is ‘morally bankrupt’ after mass layoffs, says union",11591,1622651112,2021,https://reddit.com/r/news/comments/nqpqic/air_canadas_10_million_in_bonuses_for_management/
h0byxkn,r/news,media_public,comment,"&gt; The company had a disastrous fiscal year, reporting a $3.8-billion operating loss after passenger travel declined 73 per cent during the COVID-19 pandemic. Still, its board of directors found room in the budget to approve $20-million in “Pandemic Mitigation Bonuses” for management’s “exceptional performance” during the pandemic. System has been broken for a long time, and this just proves that they don't care about the optics anymore.",,1521,1622652358,2021,https://reddit.com/r/news/comments/nqpqic/air_canadas_10_million_in_bonuses_for_management/
h0c6wre,r/news,media_public,comment,&gt;Air Canada and the Canadian government agreed Monday on financing that will allow the airline to access as much as $5.9 billion Canadian (US$4.7 billion) to help it recover from the economic damage caused by the pandemic.,,138,1622655538,2021,https://reddit.com/r/news/comments/nqpqic/air_canadas_10_million_in_bonuses_for_management/
h0c7f7t,r/news,media_public,comment,"Bonus for crying to the feds for bailout money, (which they did need to stay somewhat alive), but then taking their cut off the top, because they did the job of crying so well. And the money is probably in the Cayman Islands or someplace similar by now.",,192,1622655744,2021,https://reddit.com/r/news/comments/nqpqic/air_canadas_10_million_in_bonuses_for_management/
h0cv9wf,r/news,media_public,comment,....They don't care. Why the fuck anyone on this planet thinks that their employer or their government is on their side is beyond me.,,78,1622665653,2021,https://reddit.com/r/news/comments/nqpqic/air_canadas_10_million_in_bonuses_for_management/
h0bwki6,r/news,media_public,comment,Yes. They laid workers off. Congrats. You deserve as bonus.,,78,1622651485,2021,https://reddit.com/r/news/comments/nqpqic/air_canadas_10_million_in_bonuses_for_management/
m7q3j8,r/news,media_public,post,"US jobless claims rise to 770,000 with layoffs still high","US jobless claims rise to 770,000 with layoffs still high",1838,1616071801,2021,https://reddit.com/r/news/comments/m7q3j8/us_jobless_claims_rise_to_770000_with_layoffs/
grcxs5l,r/news,media_public,comment,"Everyone I know over 60 is retiring. Companies are laying off workers in droves even so. Gonna be a labor pinch, I think.",,244,1616075985,2021,https://reddit.com/r/news/comments/m7q3j8/us_jobless_claims_rise_to_770000_with_layoffs/
grdjfaw,r/news,media_public,comment,My wife has been on the job hunt. Finding job offers aren't the issue. Her problem is that no one wants to pay a wage that reflects the position and requirements because of covid. Jobs that should be worth $40-50k are being low balled for $20-30k? Get fucked. Corporate: *We CaNt HiRe AnY QuAliTy EmPlOYeEs*,,200,1616083300,2021,https://reddit.com/r/news/comments/m7q3j8/us_jobless_claims_rise_to_770000_with_layoffs/
grd7dtr,r/news,media_public,comment,"This is going to continue. I know companies who in previous years that went from multi million some close to billion dollar companies in “secure” fields. Tech, oil explorations, etc. that are all looking at major layoffs of like round 3 and 4 right now. While some are looking at closing their doors by the end of 2021 because while stuff is opened back up, people requesting new projects and such are still way down and don’t appear to be going back up anytime soon.",,97,1616079321,2021,https://reddit.com/r/news/comments/m7q3j8/us_jobless_claims_rise_to_770000_with_layoffs/
grdsbc5,r/news,media_public,comment,"Count my wife in that figure - furloughed and now collecting unemployment. Unlikely that she’ll be called back to her employer. We were just about to put our house on the market and leave Aurora, IL. Had four shootings in a year within a few blocks - one immediately behind my house. We’re stuck here in this hell until either she gets called back or gets a new job.",,24,1616086731,2021,https://reddit.com/r/news/comments/m7q3j8/us_jobless_claims_rise_to_770000_with_layoffs/
grd3709,r/news,media_public,comment,The only jobs I see are sales and entry levels jobs or programming obs paying 100k and up. Not sure where all the jobs in between went....,,149,1616077825,2021,https://reddit.com/r/news/comments/m7q3j8/us_jobless_claims_rise_to_770000_with_layoffs/
lxlgy1,r/news,media_public,post,"US jobless claims tick up to 745,000 as layoffs remain high","US jobless claims tick up to 745,000 as layoffs remain high",666,1614867375,2021,https://reddit.com/r/news/comments/lxlgy1/us_jobless_claims_tick_up_to_745000_as_layoffs/
gpnqgc9,r/news,media_public,comment,"It’ll just cause the Federal Reserve to keep short rates lower for longer until unemployment is at pre-COVID levels. Those bank governors are serious about this. That means if jobs are lost, low rates forever means new ones will appear (sooner or later).",,46,1614870253,2021,https://reddit.com/r/news/comments/lxlgy1/us_jobless_claims_tick_up_to_745000_as_layoffs/
gppyrt7,r/news,media_public,comment,Laid off twice in a year. This time they shut my department after 7 weeks! Thanks covid!,,8,1614905934,2021,https://reddit.com/r/news/comments/lxlgy1/us_jobless_claims_tick_up_to_745000_as_layoffs/
gprmlxp,r/news,media_public,comment,What's up with New Hampshire?,,3,1614948225,2021,https://reddit.com/r/news/comments/lxlgy1/us_jobless_claims_tick_up_to_745000_as_layoffs/
gpq93vo,r/news,media_public,comment,Thanks Biden! Keep printing more money and stay locked down. It's working so well,,-17,1614911314,2021,https://reddit.com/r/news/comments/lxlgy1/us_jobless_claims_tick_up_to_745000_as_layoffs/
gps307g,r/news,media_public,comment,,,1,1614957063,2021,https://reddit.com/r/news/comments/lxlgy1/us_jobless_claims_tick_up_to_745000_as_layoffs/
ln5s1j,r/news,media_public,post,"US jobless claims rise to 861,000 as layoffs stay high","US jobless claims rise to 861,000 as layoffs stay high",147,1613706198,2021,https://reddit.com/r/news/comments/ln5s1j/us_jobless_claims_rise_to_861000_as_layoffs_stay/
gnz2uvd,r/news,media_public,comment,"I don't see this changing anytime soon. Even as businesses begin to reopen, many will never be able to recover their losses. If they're not already permanently closed, they're hanging by a thread.",,21,1613710339,2021,https://reddit.com/r/news/comments/ln5s1j/us_jobless_claims_rise_to_861000_as_layoffs_stay/
gnz56yg,r/news,media_public,comment,I'd be staying high too if I got laid off,,5,1613711816,2021,https://reddit.com/r/news/comments/ln5s1j/us_jobless_claims_rise_to_861000_as_layoffs_stay/
gnyybpc,r/news,media_public,comment,We’re all straight up getting fucked over. One way or another,,12,1613707626,2021,https://reddit.com/r/news/comments/ln5s1j/us_jobless_claims_rise_to_861000_as_layoffs_stay/
lh7jpn,r/news,media_public,post,"Rochester city schools stop serving students hot lunches due to layoffs, budget crunch","Rochester city schools stop serving students hot lunches due to layoffs, budget crunch",137,1613001014,2021,https://reddit.com/r/news/comments/lh7jpn/rochester_city_schools_stop_serving_students_hot/
gmvous5,r/news,media_public,comment,Maybe they should defund that dumpster fire they call a police department THAT PEPPER SPRAYS 9 year olds and feed the kids instead....,,105,1613001912,2021,https://reddit.com/r/news/comments/lh7jpn/rochester_city_schools_stop_serving_students_hot/
gmvwhqh,r/news,media_public,comment,STOP PAYING SCHOOL ADMINISTRATORS SO MUCH. STOP PAYING SCHOOL BOARD MEMBERS AT ALL. my taxes are meant for children and teachers...for education. and that means a healthy meal for those who cannot get one at home. i happily pay taxes for this.,,41,1613005751,2021,https://reddit.com/r/news/comments/lh7jpn/rochester_city_schools_stop_serving_students_hot/
gmwlv8x,r/news,media_public,comment,"As a kid I would have loved this meal tbh. As a parent I am saddened. That all being said I don't recall school meals being better quality than this, just warmer and more of it.",,6,1613019085,2021,https://reddit.com/r/news/comments/lh7jpn/rochester_city_schools_stop_serving_students_hot/
k65nag,r/news,media_public,post,"Southwest warns 6,800 employees of impending layoffs, a first for the airline","Southwest warns 6,800 employees of impending layoffs, a first for the airline",545,1607027821,2020,https://reddit.com/r/news/comments/k65nag/southwest_warns_6800_employees_of_impending/
gej4d8m,r/news,media_public,comment,"They are doing more than their counterparts &gt;US airlines, including Southwest, (LUV) received a total of $25 billion in federal help earlier this year with the condition that they not institute any involuntary job cuts through the end of September. United (UAL) and American Airlines (AAL) furloughed 32,000 employees between them on October 1, the day that prohibition ended. &gt;The airline said the cuts would take place on March 15 or April 1 for different groups of employees",,70,1607031027,2020,https://reddit.com/r/news/comments/k65nag/southwest_warns_6800_employees_of_impending/
geiywut,r/news,media_public,comment,"Yesterday the President talked for 45 minutes about how he won the election. That was his ""most important speech ever"". When was the last time the President acknowledged the toll that COVID is taking on citizens and industries like air travel? 6 months? Where is congress throughout this epidemic? Vacation?",,125,1607028779,2020,https://reddit.com/r/news/comments/k65nag/southwest_warns_6800_employees_of_impending/
gejvuzu,r/news,media_public,comment,"Airline employee here, Southwest is doing something all airlines have been doing all year, negotiating in public. Southwest has been asking employees the past couple months to take pay cuts to avoid furloughs. The CARES Act staved off a lot of the furlough pressure but only temporary. At the peak, at least in the US, the largest airlines had cash burns over 50 million dollars a day. When a CARES Act extension seemed to be in doubt, the airlines decided the best way to show Washington how dire the situation could be, they sent out WARN letters to tens of thousands of employees. With strategic planning, Southwest figured out a way to mitigate furloughs and promised everyone will stay on property until 2021. American, Delta, United were amongst the largest airlines to actually send out the WARN letters. It was a game of chicken against Washington to show they're serious about furloughs without help. In the 11th hour, the unionized work groups at most airlines were able to agree to temporary major compensation cuts in order to keep as many people as they can employed. American didn't budge and thousands of people are on the street. Southwest now is trying to do two things, pressure another bailout and pressure employees to take a paycut so they don't face the fate of the AA folks. Will Southwest furlough? Probably not. Will they scare the shit of of everyone during these negotiations? They're gonna try.",,36,1607046508,2020,https://reddit.com/r/news/comments/k65nag/southwest_warns_6800_employees_of_impending/
gej4f9v,r/news,media_public,comment,Glad those tax breaks are going to good use,,48,1607031051,2020,https://reddit.com/r/news/comments/k65nag/southwest_warns_6800_employees_of_impending/
k1a6f5,r/news,media_public,post,"Disney to layoff about 32,000 workers in first half of 2021","Disney to layoff about 32,000 workers in first half of 2021",2631,1606372800,2020,https://reddit.com/r/news/comments/k1a6f5/disney_to_layoff_about_32000_workers_in_first/
gdmxeag,r/news,media_public,comment,"""Just find something new"" -ivanka trump",,993,1606374121,2020,https://reddit.com/r/news/comments/k1a6f5/disney_to_layoff_about_32000_workers_in_first/
gdnmjsf,r/news,media_public,comment,"I bet Bob chapek is having a fun first year as CEO of Disney. Literally a few weeks after he takes over, the company’s businesses take a massive nose dive thanks to a literal plague shutting down their biggest revenue generators (movies, cruises and theme parks) indefinitely.",,112,1606393516,2020,https://reddit.com/r/news/comments/k1a6f5/disney_to_layoff_about_32000_workers_in_first/
gdn0twf,r/news,media_public,comment,M-i-c k-e-y C-o-v-i-d,,399,1606377139,2020,https://reddit.com/r/news/comments/k1a6f5/disney_to_layoff_about_32000_workers_in_first/
gdmyose,r/news,media_public,comment,Princesses doing double duty as Winnie The Pooh characters?,,113,1606375252,2020,https://reddit.com/r/news/comments/k1a6f5/disney_to_layoff_about_32000_workers_in_first/
gdmyxpw,r/news,media_public,comment,Orlando is so screwed. I don’t like this!,,208,1606375475,2020,https://reddit.com/r/news/comments/k1a6f5/disney_to_layoff_about_32000_workers_in_first/
jwrq9g,r/news,media_public,post,"Next stop? New York’s MTA warns of 40% service cut, 9,300 layoffs","Next stop? New York’s MTA warns of 40% service cut, 9,300 layoffs",63,1605744203,2020,https://reddit.com/r/news/comments/jwrq9g/next_stop_new_yorks_mta_warns_of_40_service_cut/
gcs44tw,r/news,media_public,comment,This is a terrible idea. Talk about using the pandemic to escalate every single other societal problem. Increase toll fees and vehicle registration fees instead to make up the shortfall. The feds openly don't give a shit - they aren't going to come to the rescue. This level of service cuts would absolutely decimate NYC for years.,,19,1605747241,2020,https://reddit.com/r/news/comments/jwrq9g/next_stop_new_yorks_mta_warns_of_40_service_cut/
gcssqxe,r/news,media_public,comment,"They could look forward and extend the 3 and 1 lines during the downtime and even out platforms to use 4 different cars instead of 7, plus an upgrade to the Amtrak bridge and entrance that's always causing suspensions. They won't, but they could.",,3,1605761219,2020,https://reddit.com/r/news/comments/jwrq9g/next_stop_new_yorks_mta_warns_of_40_service_cut/
gcsuvhc,r/news,media_public,comment,"The MTA is an absolute shitshow. It's basically a slush fund that the State of New York uses to bail out politically-connected businesses with nothing to do with transit such as ski resorts. As a result, the system was facing a budget shortfall even before COVID. It is managed in an unsustainable manner. To fix the budget shortfall, the system is constantly looking for ways to quietly raise fairs on anyone using the train to get to work, while at the same time giving fare breaks to specific demographics to buy votes for their political patrons. They also had to add a surcharge on Uber/Lyft rides to midtown to push the cost/benefit calculation back in favor of transit following the fare hikes considering that the fare hikes was coincident with a deteriorating ratio of on-time trains. It's also one of the only systems globally to require 2 conductors on each train - 1 to drive, and one in the middle of the train to ""supervise boarding"" which consists of poking their head out the window and looking both ways as the doors are closed. They also recently had a string on psychologically unwell individuals pushing patrons off of the platform, so now the MTA has a number of additional staff standing on certain platforms to make sure people don't stand too close to the edge (some platforms are too narrow to safely handle the number of rush-hour passengers), but most of the day they just stand around and shoot the shit with each other. They recently hired the former head of the Toronto system to fix the problems, but he quit after 2 years since no one listened to him and the labor union's single goal was to get more people hired and paid a higher salary to do less work (see above practices). The State government, specifically the governor, had long-standing goals to find new revenue sources and saw the MTA budget crutch as his foot in the door. He managed to get fees added to ride hail apps, but got shut down on ""surge pricing"" into Manhattan during work hours which was a euph",,4,1605762700,2020,https://reddit.com/r/news/comments/jwrq9g/next_stop_new_yorks_mta_warns_of_40_service_cut/
gctc9jw,r/news,media_public,comment,"Every year they want more money, every year they raise the fare, every year they're going broke. Where's all this fucking money going? Something smells fishy... Oh yeah it's the subway...",,4,1605778268,2020,https://reddit.com/r/news/comments/jwrq9g/next_stop_new_yorks_mta_warns_of_40_service_cut/
